{
  "hosts": [
    {
      "name": "bkp-vault-02",
      "type": "Host",
      "attrs": {
        "display_name": "bkp-vault-02",
        "host_name": "bkp-vault-02",
        "address": "10.51.9.66",
        "state": 0,
        "state_type": 1,
        "acknowledgement": 0,
        "downtime_depth": 0,
        "groups": [
          "backup-tier"
        ],
        "enable_active_checks": true,
        "last_check": 1794988740,
        "last_check_result": {
          "output": "PING OK - Packet loss = 0%, RTA = 1.04 ms",
          "state": 0,
          "exit_status": 0,
          "execution_end": 1794988740
        }
      }
    }
  ],
  "services": [
    {
      "name": "bkp-vault-02!backup-volume-free",
      "type": "Service",
      "attrs": {
        "display_name": "/srv/restic free space",
        "host_name": "bkp-vault-02",
        "state": 0,
        "enable_active_checks": true,
        "check_interval": 900,
        "last_state_change": 1793361600,
        "last_check": 1794988260,
        "last_check_result": {
          "output": "DISK OK - /srv/restic 41% used",
          "state": 0,
          "exit_status": 0,
          "execution_end": 1794988260
        },
        "state_type": 1,
        "check_attempt": 1,
        "max_check_attempts": 3,
        "acknowledgement": 0,
        "downtime_depth": 0,
        "enable_notifications": true
      }
    },
    {
      "name": "bkp-vault-02!restic-repo-integrity",
      "type": "Service",
      "attrs": {
        "display_name": "restic repository integrity",
        "host_name": "bkp-vault-02",
        "state": 0,
        "enable_active_checks": true,
        "check_interval": 3600,
        "last_state_change": 1793502000,
        "last_check": 1794987000,
        "last_check_result": {
          "output": "RESTIC OK - check passed, no errors in 3 packs sampled",
          "state": 0,
          "exit_status": 0,
          "execution_end": 1794987000
        },
        "state_type": 1,
        "check_attempt": 1,
        "max_check_attempts": 3,
        "acknowledgement": 0,
        "downtime_depth": 0,
        "enable_notifications": true
      }
    },
    {
      "name": "bkp-vault-02!restic-snapshot-age",
      "type": "Service",
      "attrs": {
        "display_name": "restic newest snapshot age",
        "host_name": "bkp-vault-02",
        "state": 0,
        "enable_active_checks": false,
        "check_interval": 1800,
        "last_state_change": 1793758800,
        "last_check": 1794190500,
        "last_check_result": {
          "output": "RESTIC OK - newest snapshot of vault-data is 5h old (warn 26h, crit 50h)",
          "state": 0,
          "exit_status": 0,
          "execution_end": 1794190500
        },
        "state_type": 1,
        "check_attempt": 1,
        "max_check_attempts": 3,
        "acknowledgement": 0,
        "downtime_depth": 0,
        "enable_notifications": true
      }
    }
  ],
  "comments": [],
  "downtimes": []
}
