{
  "hosts": [
    {
      "name": "s3gw-ash-1",
      "type": "Host",
      "attrs": {
        "display_name": "s3gw-ash-1",
        "host_name": "s3gw-ash-1",
        "address": "10.33.7.21",
        "state": 0,
        "state_type": 1,
        "acknowledgement": 0,
        "downtime_depth": 0,
        "groups": [
          "objstore-ash"
        ],
        "last_check": 1796307000,
        "last_check_result": {
          "output": "PING OK - Packet loss = 0%",
          "state": 0,
          "exit_status": 0
        }
      }
    },
    {
      "name": "s3gw-ash-2",
      "type": "Host",
      "attrs": {
        "display_name": "s3gw-ash-2",
        "host_name": "s3gw-ash-2",
        "address": "10.33.7.22",
        "state": 0,
        "state_type": 1,
        "acknowledgement": 0,
        "downtime_depth": 0,
        "groups": [
          "objstore-ash"
        ],
        "last_check": 1796307000,
        "last_check_result": {
          "output": "PING OK - Packet loss = 0%",
          "state": 0,
          "exit_status": 0
        }
      }
    }
  ],
  "services": [
    {
      "name": "s3gw-ash-1!objstore-pool",
      "type": "Service",
      "attrs": {
        "display_name": "ZFS pool tank0 usage",
        "host_name": "s3gw-ash-1",
        "state": 1,
        "state_type": 1,
        "check_attempt": 1,
        "max_check_attempts": 3,
        "acknowledgement": 0,
        "downtime_depth": 0,
        "last_state_change": 1796240400,
        "last_check": 1796306880,
        "last_check_result": {
          "output": "POOL WARNING - tank0 above warning threshold",
          "performance_data": [
            "tank0_used=412GB;400;460;0;500"
          ],
          "state": 1,
          "exit_status": 1
        }
      }
    },
    {
      "name": "s3gw-ash-1!rgw-sync",
      "type": "Service",
      "attrs": {
        "display_name": "RGW multisite sync",
        "host_name": "s3gw-ash-1",
        "state": 0,
        "state_type": 1,
        "check_attempt": 1,
        "max_check_attempts": 3,
        "acknowledgement": 0,
        "downtime_depth": 0,
        "last_state_change": 1795154400,
        "last_check": 1796306940,
        "last_check_result": {
          "output": "RGW SYNC OK - data sync caught up, 0 shards behind",
          "performance_data": [
            "shards_behind=0;8;32;0"
          ],
          "state": 0,
          "exit_status": 0
        }
      }
    },
    {
      "name": "s3gw-ash-2!objstore-pool",
      "type": "Service",
      "attrs": {
        "display_name": "ZFS pool tank0 usage",
        "host_name": "s3gw-ash-2",
        "state": 0,
        "state_type": 1,
        "check_attempt": 1,
        "max_check_attempts": 3,
        "acknowledgement": 0,
        "downtime_depth": 0,
        "last_state_change": 1795778100,
        "last_check": 1796306820,
        "last_check_result": {
          "output": "POOL OK - tank0 within limits",
          "performance_data": [
            "tank0_used=318GB;400;460;0;500"
          ],
          "state": 0,
          "exit_status": 0
        }
      }
    }
  ],
  "comments": [],
  "downtimes": []
}
